Event Label,Event Type,Headline,Source,Date,URL
Myanmar Earthquake Mar 2025,Recent,MSF urges Sudan's warring parties to immediately spare civilians and humanitarian workers,MSF,,https://reliefweb.int/report/sudan/msf-urges-warring-parties-immediately-spare-civilians-and-humanitarian-workers
Myanmar Earthquake Mar 2025,Recent,Urgent multisectoral action needed as 3.3 million Kenyans face acute hunger in ASAL counties,Action Against Hunger,,https://reliefweb.int/report/kenya/urgent-33-million-kenyans-face-acute-hunger-multi-year-drought-devastates-asal-counties-urgent-multisectoral-action-needed-save-lives
Myanmar Earthquake Mar 2025,Recent,UN and partners launch $67.8 million cyclone flash appeal for Madagascar,OCHA,,https://reliefweb.int/report/madagascar/united-nations-and-humanitarian-partners-launch-us678-million-cyclone-flash-appeal-madagascar-enfr
Myanmar Earthquake Mar 2025,Recent,Afghanistan Humanitarian Fund supports families facing a harsh winter,OCHA,2026-03-01T07:53:19+00:00,https://reliefweb.int/report/afghanistan/afghanistan-humanitarian-fund-supports-families-facing-harsh-winter
Myanmar Earthquake Mar 2025,Recent,Syrian Arab Republic: Aleppo and Northeast Escalation Subdistrict-Level IDP Figures | 25 February 2026,OCHA,2026-02-28T09:51:02+00:00,https://reliefweb.int/map/syrian-arab-republic/syrian-arab-republic-aleppo-and-northeast-escalation-subdistrict-level-idp-figures-25-february-2026
Myanmar Earthquake Mar 2025,Recent,Myanmar Earthquake: HNRP Flash Addendum - Issued April 2025,Appeals And Response Plans,,https://reliefweb.int/report/myanmar/myanmar-earthquake-hnrp-flash-addendum-issued-april-2025
Myanmar Earthquake Mar 2025,Recent,Myanmar earthquake emergency - UNHCR response to urgent needs of displaced people and host communities (April - December 2025),Appeals And Response Plans,,https://reliefweb.int/report/myanmar/myanmar-earthquake-emergency-unhcr-response-urgent-needs-displaced-people-and-host-communities-april-december-2025
Myanmar Earthquake Mar 2025,Recent,IOM Flash Appeal Myanmar Earthquake Response | Early Recovery Amendment (29 March - 31 December 2025),Appeals And Response Plans,,https://reliefweb.int/report/myanmar/iom-flash-appeal-myanmar-earthquake-response-early-recovery-amendment-29-march-31-december-2025
Myanmar Earthquake Mar 2025,Recent,IOM Flash Appeal Myanmar Earthquake Response (29 March 2025 - 30 June 2025),Appeals And Response Plans,,https://reliefweb.int/report/myanmar/iom-flash-appeal-myanmar-earthquake-response-29-march-2025-30-june-2025
Myanmar Earthquake Mar 2025,Recent,Myanmar Earthquake Flash Appeal (April 2025 - September 2025),Appeals And Response Plans,,https://reliefweb.int/report/myanmar/myanmar-earthquake-flash-appeal-april-2025-september-2025
Myanmar Earthquake Mar 2025,Recent,"Myanmar, Asia Pacific | Myanmar Earthquake - Emergency Appeal (MDRMM023)",Appeals And Response Plans,,https://reliefweb.int/report/myanmar/myanmar-asia-pacific-myanmar-earthquake-emergency-appeal-mdrmm023
Myanmar Earthquake Mar 2025,Recent,End of Mission Report United Nations Disaster Assessment & Coordination (UNDAC) - Earthquake 7.7M Response - Myanmar (29Mar-16Apr 2025),Appeals And Response Plans,,https://reliefweb.int/report/myanmar/end-mission-report-united-nations-disaster-assessment-coordination-undac-earthquake-77m-response-myanmar-29mar-16apr-2025
Myanmar Earthquake Mar 2025,Recent,GIEWS Country Brief: Myanmar 20-February-2026,Appeals And Response Plans,,https://reliefweb.int/report/myanmar/giews-country-brief-myanmar-20-february-2026
Myanmar Earthquake Mar 2025,Recent,"UNICEF Myanmar Humanitarian Situation Report No. 4, January-December 2025",Appeals And Response Plans,,https://reliefweb.int/report/myanmar/unicef-myanmar-humanitarian-situation-report-no-4-january-december-2025
Myanmar Earthquake Mar 2025,Recent,Asia and the Pacific Regional Humanitarian Overview 2025 (As of 31 January 2026),Appeals And Response Plans,,https://reliefweb.int/report/afghanistan/asia-and-pacific-regional-humanitarian-overview-2025-31-january-2026
Myanmar Earthquake Mar 2025,Recent,Earthquakes global overview | 1 January – 31 December 2025 - DG ECHO Daily Map | 12/01/2026,Appeals And Response Plans,,https://reliefweb.int/map/world/earthquakes-global-overview-1-january-31-december-2025-dg-echo-daily-map-12012026
Myanmar Earthquake Mar 2025,Recent,"Myanmar: Insights from MIMU HDP Nexus 5W - Earthquake Response, August 2025 Round",Appeals And Response Plans,,https://reliefweb.int/report/myanmar/myanmar-insights-mimu-hdp-nexus-5w-earthquake-response-august-2025-round
China Earthquake Jun 2012,Historical,China: Annual Report 2012 (MAACN001),IFRC,2013-05-08T10:31:17+00:00,https://reliefweb.int/report/china/china-annual-report-2012-maacn001
China Earthquake Jun 2012,Historical,Natural disasters in China showed 6 features in 2012,Govt. China,2013-01-07T12:26:37+00:00,https://reliefweb.int/report/china/natural-disasters-china-showed-6-features-2012
China Earthquake Jun 2012,Historical,East Asia (MAA54001) Mid-Year Report 2012,IFRC,2012-09-04T09:28:02+00:00,https://reliefweb.int/report/democratic-peoples-republic-korea/east-asia-maa54001-mid-year-report-2012
China Earthquake Jun 2012,Historical,China (MAACN001) Mid-Year Report 2012,IFRC,2012-08-29T00:00:00+00:00,https://reliefweb.int/report/china/china-maacn001-mid-year-report-2012
China Earthquake Jun 2012,Historical,"IDP News Alert, 25 July 2012",IDMC,2012-07-25T13:05:33+00:00,https://reliefweb.int/report/mali/idp-news-alert-25-july-2012
China Earthquake Jun 2012,Historical,Central gov't allocates 122 mln USD for disaster relief fund,Xinhua,2012-07-20T09:54:33+00:00,https://reliefweb.int/report/china/central-govt-allocates-122-mln-usd-disaster-relief-fund
China Earthquake Jun 2012,Historical,Relief efforts in quake-hit Xinjiang ongoing,Xinhua,2012-07-04T01:01:55+00:00,https://reliefweb.int/report/china/relief-efforts-quake-hit-xinjiang-ongoing
China Earthquake Jun 2012,Historical,Xinjiang Earthquake 2012: Work Report 1,HKRC,2012-07-02T04:32:40+00:00,https://reliefweb.int/report/china/xinjiang-earthquake-2012-work-report-1
China Earthquake Jun 2012,Historical,China: Earthquake (as of 01 July 2012) - Location Map,OCHA,2012-07-02T00:00:00+00:00,https://reliefweb.int/map/china/china-earthquake-01-july-2012-location-map
China Earthquake Jun 2012,Historical,"155,000 people affected after Xinjiang quake",Xinhua,2012-07-01T23:58:26+00:00,https://reliefweb.int/report/china/155000-people-affected-after-xinjiang-quake
China Earthquake Jun 2012,Historical,"35 injured, 64,500 people affected in Xinjiang quake",Xinhua,2012-06-30T04:00:00+00:00,https://reliefweb.int/report/china/35-injured-64500-people-affected-xinjiang-quake
China Earthquake Jun 2012,Historical,China: Annual Report 2012 (MAACN001),Latest Updates,,https://reliefweb.int/report/china/china-annual-report-2012-maacn001
China Earthquake Jun 2012,Historical,Natural disasters in China showed 6 features in 2012,Latest Updates,,https://reliefweb.int/report/china/natural-disasters-china-showed-6-features-2012
China Earthquake Jun 2012,Historical,East Asia (MAA54001) Mid-Year Report 2012,Latest Updates,,https://reliefweb.int/report/democratic-peoples-republic-korea/east-asia-maa54001-mid-year-report-2012
China Earthquake Jun 2012,Historical,China: Earthquake (as of 01 July 2012) - Location Map,Latest Updates,,https://reliefweb.int/map/china/china-earthquake-01-july-2012-location-map
China Earthquake Jun 2012,Historical,"155,000 people affected after Xinjiang quake",Latest Updates,,https://reliefweb.int/report/china/155000-people-affected-after-xinjiang-quake
